{
  "schema_version": "1.0.0",
  "analysis_scope": "product_only",
  "product": {"product_id": "synthetic-three-pay", "name": "Synthetic Three-Pay Whole Life", "insurer": "Synthetic Fixture Mutual", "currency": "CNY", "product_type": "participating_whole_life", "jurisdiction": "TEST", "participating": true},
  "sources": [{"source_id": "src-three", "title": "Synthetic three-pay benchmark", "kind": "synthetic_benchmark", "version": "1.0.0", "document_sha256": "ec447030b8f24ca05da8493621815840a5a1713a40a218ac525841b7a07c2e8b"}],
  "evidence": [{"evidence_id": "ev-three-table", "source_id": "src-three", "document_sha256": "ec447030b8f24ca05da8493621815840a5a1713a40a218ac525841b7a07c2e8b", "page": 1, "bbox": [0, 0, 1, 1], "raw_text": "Synthetic three-pay benchmark schedule", "content_sha256": "ec447030b8f24ca05da8493621815840a5a1713a40a218ac525841b7a07c2e8b", "extractor": "manual_gold_fixture", "extractor_version": "1.0.0", "confidence": 1.0, "reason_codes": ["synthetic_fixture"]}],
  "cases": [
    {
      "case_id": "LLPI-STD-3PAY-100K-v1",
      "label": "Three annual payments of CNY 100,000; no personal attributes",
      "basis": {"kind": "standard_benchmark", "benchmark_version": "1.0.0"},
      "timing": {"issue_date": "2026-01-01", "premium_timing": "explicit_dates", "benefit_timing": "projection_date"},
      "amount_scale": "currency_unit",
      "inflation_rate": "0.02",
      "premium_cashflows": [
        {"date": "2026-01-01", "time_years": "0", "amount": "100000.00"},
        {"date": "2027-01-01", "time_years": "1", "amount": "100000.00"},
        {"date": "2028-01-01", "time_years": "2", "amount": "100000.00"}
      ],
      "scenario_definitions": {"current": {"label": "Current non-guaranteed illustration", "guaranteed": false}},
      "projection": [
        {"policy_year": 1, "date": "2026-12-31", "time_years": "1", "death_benefit": {"guaranteed": "600000.00", "scenarios": {"current": "610000.00"}}, "cash_surrender_value": {"guaranteed": "70000.00", "scenarios": {"current": "75000.00"}}},
        {"policy_year": 2, "date": "2027-12-31", "time_years": "2", "death_benefit": {"guaranteed": "600000.00", "scenarios": {"current": "625000.00"}}, "cash_surrender_value": {"guaranteed": "160000.00", "scenarios": {"current": "175000.00"}}},
        {"policy_year": 3, "date": "2028-12-31", "time_years": "3", "death_benefit": {"guaranteed": "600000.00", "scenarios": {"current": "650000.00"}}, "cash_surrender_value": {"guaranteed": "270000.00", "scenarios": {"current": "300000.00"}}},
        {"policy_year": 4, "date": "2029-12-31", "time_years": "4", "death_benefit": {"guaranteed": "600000.00", "scenarios": {"current": "675000.00"}}, "cash_surrender_value": {"guaranteed": "310000.00", "scenarios": {"current": "350000.00"}}},
        {"policy_year": 5, "date": "2030-12-31", "time_years": "5", "death_benefit": {"guaranteed": "600000.00", "scenarios": {"current": "700000.00"}}, "cash_surrender_value": {"guaranteed": "340000.00", "scenarios": {"current": "400000.00"}}},
        {"policy_year": 10, "date": "2035-12-31", "time_years": "10", "death_benefit": {"guaranteed": "600000.00", "scenarios": {"current": "750000.00"}}, "cash_surrender_value": {"guaranteed": "550000.00", "scenarios": {"current": "700000.00"}}},
        {"policy_year": 20, "date": "2045-12-31", "time_years": "20", "death_benefit": {"guaranteed": "600000.00", "scenarios": {"current": "900000.00"}}, "cash_surrender_value": {"guaranteed": "590000.00", "scenarios": {"current": "950000.00"}}}
      ]
    }
  ],
  "provenance": {
    "/product": {"evidence_ids": ["ev-three-table"], "extractor": "manual_gold_fixture", "extractor_version": "1.0.0", "confidence": 1.0, "status": "accepted", "reason_codes": ["synthetic_fixture"]},
    "/cases/0": {"evidence_ids": ["ev-three-table"], "extractor": "manual_gold_fixture", "extractor_version": "1.0.0", "confidence": 1.0, "status": "accepted", "reason_codes": ["synthetic_fixture"]},
    "/cases/0/premium_cashflows": {"evidence_ids": ["ev-three-table"], "extractor": "manual_gold_fixture", "extractor_version": "1.0.0", "confidence": 1.0, "status": "accepted", "reason_codes": ["synthetic_fixture"]},
    "/cases/0/projection": {"evidence_ids": ["ev-three-table"], "extractor": "manual_gold_fixture", "extractor_version": "1.0.0", "confidence": 1.0, "status": "accepted", "reason_codes": ["synthetic_fixture"]}
  }
}
